E1: √од | F1: —еместр | G1: ѕоследовательность видов зан€тий | H1: Ћекции | I1: ѕ« | J1: —еминары | K1: онтр. –аб. | L1: оллоквиум | M1: »« | N1: Ћаб. –аб. | O1: «ачет | P1: Ёкзамен | T1: «ан€тие | U1: ћетодические указани€ | V1: —писок ƒ (дл€ Ќ“ќ) | W1: ол-во ƒ (дл€ Ќ“ќ) | Y1: ƒомашнии задани€ | Z1: урсовые работы | AA1: урсовые проекты | AB1: –ефераты
C2: 1 | D2: 0 | E2: 2005 | F2: 5 | G2: Ћ1ѕ1Ћ2Ћ3Ћ4Ћ5Ѕ1Ѕ1Ћ6Ћ7Ћ8ѕ2Ћ9ѕ3Ћ10Ѕ2Ѕ2ѕ4Ћ11Ћ12Ћ13«1 | H2: 26 | I2: 8 | N2: 8 | O2: 2 | T2: Ћ1 | U2: №№№№№№ | AC2: 15.5
C3: 0 | D3: 0 | T3: ѕ1 | U3: №№№№№№
C4: 7 | D4: 0 | T4: Ћ2 | U4: №№№№№№
C5: 0 | D5: 0 | T5: Ћ3 | U5: №№№№№№
C6: 0 | D6: 0 | T6: Ћ4 | U6: №№№№№№
C7: 0 | D7: 0 | T7: Ћ5 | U7: №№№№№№
C8: 0 | D8: 0 | T8: Ѕ1 | U8: №№№№№№
C9: 0 | D9: 0 | T9: Ћ6 | U9: №№№№№№
C10: 0 | D10: 0 | T10: Ћ7 | U10: №№№№№№
C11: 0 | D11: 0 | T11: Ћ8 | U11: №№№№№№
C12: 0 | D12: 0 | T12: ѕ2 | U12: №№№№№№
C13: 0 | D13: 0 | T13: Ћ9 | U13: №№№№№№
C14: 0 | D14: 0 | T14: ѕ3 | U14: №№№№№№
C15: 0 | D15: 0 | T15: Ћ10 | U15: №№№№№№
C16: 0 | D16: 0 | T16: Ѕ2 | U16: №№№№№№
C17: 0 | D17: 0 | G17: »того по курсу: | H17: =SUM(H2:H16) -> 26 | I17: =SUM(I2:I16) -> 8 | J17: =SUM(J2:J16) -> 0 | K17: =SUM(K2:K16) -> 0 | L17: =SUM(L2:L16) -> 0 | M17: =SUM(M2:M16) -> 0 | N17: =SUM(N2:N16) -> 8 | O17: =SUM(O2:O16) -> 2 | P17: =SUM(P2:P16) -> 0 | T17: ѕ4 | U17: №№№№№№ | Y17: =SUM(Y2:Y16) -> 0 | Z17: =SUM(Z2:Z16) -> 0 | AA17: =SUM(AA2:AA16) -> 0 | AB17: =SUM(AB2:AB16) -> 0 | AC17: =SUM(AC2:AC16) -> 15.5
T18: Ћ11 | U18: №№№№№№
T19: Ћ12 | U19: №№№№№№
T20: Ћ13 | U20: №№№№№№
T21: «1 | U21: №№№№№№